{
  "projectName": "Accessibility Audit Lab",
  "target": "./examples/simple-html-site/index.html",
  "auditedAt": "2026-07-01T17:05:50.054Z",
  "summary": {
    "critical": 3,
    "serious": 2,
    "moderate": 5,
    "minor": 0,
    "manualReview": 12
  },
  "issues": [
    {
      "id": "button-name",
      "title": "Buttons must have discernible text",
      "severity": "critical",
      "wcag": [
        "4.1.2"
      ],
      "principle": "Robust",
      "location": "button",
      "explanation": "Ensure buttons have discernible text",
      "nextSteps": [
        "Add visible text, an aria-label, or an aria-labelledby reference that clearly names the button’s purpose."
      ],
      "source": "axe-core"
    },
    {
      "id": "color-contrast",
      "title": "Elements must meet minimum color contrast ratio thresholds",
      "severity": "serious",
      "wcag": [
        "1.4.3"
      ],
      "principle": "Perceivable",
      "location": "p",
      "explanation": "Ensure the contrast between foreground and background colors meets WCAG 2 AA minimum contrast ratio thresholds",
      "nextSteps": [
        "Increase the contrast between text and background to meet at least a 4.5:1 ratio (3:1 for large text)."
      ],
      "source": "axe-core"
    },
    {
      "id": "html-has-lang",
      "title": "<html> element must have a lang attribute",
      "severity": "serious",
      "wcag": [
        "3.1.1"
      ],
      "principle": "Understandable",
      "location": "html",
      "explanation": "Ensure every HTML document has a lang attribute",
      "nextSteps": [
        "Add a lang attribute to the <html> element so assistive technology announces content in the right language."
      ],
      "source": "axe-core"
    },
    {
      "id": "image-alt",
      "title": "Images must have alternative text",
      "severity": "critical",
      "wcag": [
        "1.1.1"
      ],
      "principle": "Perceivable",
      "location": "img",
      "explanation": "Ensure <img> elements have alternative text or a role of none or presentation",
      "nextSteps": [
        "Add meaningful alt text if the image communicates content.",
        "Use empty alt text only if the image is decorative.",
        "Avoid phrases like 'image of' unless needed for context."
      ],
      "source": "axe-core"
    },
    {
      "id": "label",
      "title": "Form elements must have labels",
      "severity": "critical",
      "wcag": [
        "4.1.2"
      ],
      "principle": "Robust",
      "location": "input",
      "explanation": "Ensure every form element has a label",
      "nextSteps": [
        "Associate a visible <label> with the form field using the for/id attributes, or wrap the field in the label."
      ],
      "source": "axe-core"
    },
    {
      "id": "landmark-one-main",
      "title": "Document should have one main landmark",
      "severity": "moderate",
      "wcag": [],
      "principle": "WCAG 2+",
      "location": "html",
      "explanation": "Ensure the document has a main landmark",
      "nextSteps": [
        "Document should have one main landmark."
      ],
      "source": "axe-core"
    },
    {
      "id": "region",
      "title": "All page content should be contained by landmarks",
      "severity": "moderate",
      "wcag": [],
      "principle": "WCAG 2+",
      "location": "h1",
      "explanation": "Ensure all page content is contained by landmarks",
      "nextSteps": [
        "All page content should be contained by landmarks."
      ],
      "source": "axe-core"
    },
    {
      "id": "region",
      "title": "All page content should be contained by landmarks",
      "severity": "moderate",
      "wcag": [],
      "principle": "WCAG 2+",
      "location": "img",
      "explanation": "Ensure all page content is contained by landmarks",
      "nextSteps": [
        "All page content should be contained by landmarks."
      ],
      "source": "axe-core"
    },
    {
      "id": "region",
      "title": "All page content should be contained by landmarks",
      "severity": "moderate",
      "wcag": [],
      "principle": "WCAG 2+",
      "location": "p",
      "explanation": "Ensure all page content is contained by landmarks",
      "nextSteps": [
        "All page content should be contained by landmarks."
      ],
      "source": "axe-core"
    },
    {
      "id": "region",
      "title": "All page content should be contained by landmarks",
      "severity": "moderate",
      "wcag": [],
      "principle": "WCAG 2+",
      "location": "form",
      "explanation": "Ensure all page content is contained by landmarks",
      "nextSteps": [
        "All page content should be contained by landmarks."
      ],
      "source": "axe-core"
    }
  ],
  "humanReviewPrompts": [
    {
      "id": "motion-review",
      "title": "Review motion and animation comfort",
      "question": "Can users pause, reduce, or avoid motion that is not essential?",
      "wcag": [
        "2.2.2",
        "2.3.3"
      ],
      "appliesTo": [
        "animation",
        "p5",
        "canvas",
        "html"
      ]
    },
    {
      "id": "flashing-review",
      "title": "Review flashing and rapid visual change risk",
      "question": "Does any content flash more than three times per second, or could it be adjusted so it doesn't?",
      "wcag": [
        "2.3.1"
      ],
      "appliesTo": [
        "animation",
        "p5",
        "canvas",
        "html"
      ]
    },
    {
      "id": "captions-review",
      "title": "Review captions for audio/video content",
      "question": "Do all pre-recorded audio and video elements have accurate captions?",
      "wcag": [
        "1.2.2"
      ],
      "appliesTo": [
        "html"
      ]
    },
    {
      "id": "transcripts-review",
      "title": "Review transcripts for media content",
      "question": "Is a full text transcript available for audio-only or video-only content?",
      "wcag": [
        "1.2.1"
      ],
      "appliesTo": [
        "html"
      ]
    },
    {
      "id": "keyboard-only-review",
      "title": "Review keyboard-only usability",
      "question": "Can every interactive element and creative interaction be reached and operated using only a keyboard?",
      "wcag": [
        "2.1.1",
        "2.1.2"
      ],
      "appliesTo": [
        "html",
        "p5",
        "canvas"
      ]
    },
    {
      "id": "cognitive-load-review",
      "title": "Review cognitive load",
      "question": "Is the interface free of unnecessary complexity, jargon, or steps that could overwhelm someone under time pressure or with a cognitive disability?",
      "wcag": [
        "3.1.5"
      ],
      "appliesTo": [
        "html",
        "p5"
      ]
    },
    {
      "id": "plain-language-navigation-review",
      "title": "Review plain-language navigation",
      "question": "Are navigation labels, menu items, and instructions written in plain, unambiguous language?",
      "wcag": [
        "3.1.5",
        "2.4.6"
      ],
      "appliesTo": [
        "html"
      ]
    },
    {
      "id": "sound-alternative-review",
      "title": "Review sound-based interaction alternatives",
      "question": "Is sound-based feedback or interaction also available through a visual or text alternative?",
      "wcag": [
        "1.1.1",
        "1.2.1"
      ],
      "appliesTo": [
        "p5",
        "canvas",
        "html"
      ]
    },
    {
      "id": "touch-target-review",
      "title": "Review touch target size",
      "question": "Are interactive touch targets at least 24 by 24 CSS pixels, or given adequate spacing if smaller?",
      "wcag": [
        "2.5.8"
      ],
      "appliesTo": [
        "html",
        "p5",
        "canvas"
      ]
    },
    {
      "id": "consistent-help-review",
      "title": "Review consistent help placement",
      "question": "If help mechanisms exist across multiple pages, do they appear in the same relative order each time?",
      "wcag": [
        "3.2.6"
      ],
      "appliesTo": [
        "html"
      ]
    },
    {
      "id": "accessible-authentication-review",
      "title": "Review accessible authentication",
      "question": "Does authentication avoid relying solely on cognitive function tests such as memorizing passwords or solving puzzles, without an alternative?",
      "wcag": [
        "3.3.8"
      ],
      "appliesTo": [
        "html"
      ]
    },
    {
      "id": "multilingual-labels-review",
      "title": "Review multilingual accessibility notes",
      "question": "If the project serves multiple languages, are accessibility labels, alt text, and instructions translated and reviewed by fluent speakers?",
      "wcag": [
        "3.1.2"
      ],
      "appliesTo": [
        "html",
        "p5"
      ]
    }
  ]
}